제주 실탄 사격장,제주 실탄 사격장!,"제주에서 실탄사격장으로는 중문랜드와 대유랜드 두 곳이 있습니다.


위치는 예래사우나 바로 옆, 버스 이용시 운암동 정류소에서 하차하시면 됩니다.
실내라서 날씨에 관계 없이 언제든지 이용 가능하다는 이점과 순식간이라는 12발의 제한적 시간, 뭔가 알듯하면 끝나버리는 아쉬움이 있습니다.

영화에서 보면 배우들이 총을 쏘며 뛰고 달리고 하는데 직접 해보시면 알겠지만 반동이 상당히 큽니다. 쏘는 거 자체도 힘들지만 상대를 명중시키는 것은 거의 불가능합니다.
또 이어폰을 착용함에도 소리가 상당합니다. 무방비 상태에서의 마구잡이 총격은 고막 손상으로 이어집니다.

결론적으로 영화에서 보여주는 총격신은 만화와 같은 허구로 판명! 물론 충분한 훈련을 한 특수요원의 경우라면 다를 수도 있겠습니다.",53,3654,2014/10,4,가을
더 아일랜더,색다른 기념품을 구입하기 좋은 곳,"제주도에 오면 보통 초콜릿을 많이 사가는데..
그런 기념품이 아닌 점더 제주스러운 기념품을
살 수 있는 곳.제주에서 활동하는 디자이너들이
직접 만든 소품,엽서,비누,향초등을 판다.
공항 가까이에 있어 제주도를 떠나는 날 방문하기에 좋다.제주도에 올때마다 들리는 곳.",54,3655,2017/02,4,겨울
더 아일랜더,좋아요,"예술가들이 직접 제작한 소품들이
아기자기 전시되어 있는곳입니다
향초라든지 제주의 퍼즐 또는 직접만든 컵이라든지~~
사고싶은 욕망이 막 생기는곳
매장은 크지 앉지만
인테리어와 소품들이 너무 이쁜곳이네요",54,3656,2017/02,3,겨울
더 아일랜더,제주에 가면 꼭 들러야 하는 Art shop,"관광이 아니라 여행을 원한다면, 꼭 들러야 하는 장소. 제주를 기반으로 한 예술가들의 다양한 작품과 소품을 판매합니다. 다른 곳에서 보기 힘든, 제주에서만 볼 수 있는 것들. 그리고 제주의 자연이 사람들에게 어떻게 영향을 주는지 보실 수 있습니다. 이 작은 가게에서만 한참을 머무르게 됩니다.",54,3657,2016/04,5,봄
더 아일랜더,색다른 기념품을 사고싶다면,"색다른 기념품을 사기 위해 들른 곳
제주도하면 초콜릿이나 과일 등등 흔한 기념품을 생각하지만
여기에는 좀 다른 종류의 기념품이 많아
사고싶은 욕구를 눌르기 힘들었어요
한라봉향초는 부담없는 가격으로 선물용으로도 좋았습니다.",54,3658,2015/11,4,가을
더 아일랜더,제주스러운 예쁜 소품과 웃음이 가득한 곳!!,"흔하지 않은, 그래서 더 소장하고 싶은
제주느낌 가득한 예쁜 소품들이 너무 많아요!!! + 거기에 친절하시기까지!!!!
한번 들어가면 나오기 아쉬워져요 ㅜㅜ
타이밍 잘맞추면 맛난 커피도 한잔주시구 너무 감사했어요ㅋㅋ +_+
제주도 갈때마다 꼭 가렵니다!!
강추~~~~~~>_<!!",54,3659,2015/03,5,봄
제주요 도자기 문화 박물관,제주 화산토를 이용하여 ~,"제주 화산토를 이용하하여 제주 옹기를 만들어놓은 박물관이구요....
구매도 할 수 있다고 하네요^^
여긴 어린아이들이 있는 가족여행보다는
나이 지긋하신 분들이 방문하시면 좋을 것 같다는 생각이 들었어요 ~~",55,3660,2015/09,4,가을
제주요 도자기 문화 박물관,済州窯,"제주의 화산석과 제주 흙을 이용한 다양한 작품이 전시되어 있다
여기에서 도자기도 만들며 구매할 수도 있다",55,3661,2014/12,5,겨울
송악산,멋진 경치를 볼 수 있는 곳,"마라도 여객선에서 내리자마자 송악산을 산책했습니다. 거기서 형제섬과 마라도 가파도를 볼 수 있는 전망과 곳곳에 말을 탈 수 있는 체험장소가 있어 말을 볼 수 있고, 티비에 한 번 출연했다던 염소를 볼 수가 있습니다. 일단 멋진 제주의 바다를 높은 곳에서 볼 수 있는 멋진 곳입니다.",90,3662,2017/01,4,겨울
송악산,걸어서 한 바퀴돌아보세요,"산책하러 일몰시간쯤에 갔는데 산이 가파르거나 한 건 아니라 천천히 걸어서 다니기 좋았구요, 거의 끝 쪽 갔다가 나오는데 한시간도 안 걸린 것 같아요. 산길에 가로등도 거의 없어서 너무 어두워지기 전에 나오는 게 좋긴해요. 밤에 반딧불이 날아다니는데 정말 예뻤어요.",90,3663,2016/11,5,가을
송악산,송악산,몇 년전 올레길로 걸어봤는데 이번에는 송악산 둘레길을 드라이브 했다. 사람들이 많지 않아서 조용하고 아직 관광객들이 많이 찾지 않는 듯 하여 좋았다.,90,3664,2016/11,4,가을
송악산,딱 걷기 좋은 산,"송악산은 1시간 정도면 둘러 볼 수 있어서 제주도 갈때면 자주 들리곤해요. 올라가는 길에 파전, 고구마, 막걸리도 팔고, 말타기 체험도 있고해서 심심하지도 않구요. 탁트윈 서귀포 바다를 볼 수 있어서 더 좋았어요",90,3665,2016/10,4,가을
송악산,아름다운 송악산,"제작년에 여기 하루 갔다기 너무 좋아서 올 해 초에 또 갔네요. 산에 올라가는 길이 아름다워요. 바쁜 일 끝나자 마자 떠난 여행이었는데, 꿀맛같은 여행이었어요. 나중에 또 갈 생각 있어요.",90,3666,2016/02,5,겨울
송악산,1시간정도 트랙킹코스,"송악산 꼭대기까지 천천히 오르다보면 제주도 바다가 눈 앞에 탁 트이게 됩니다. 그리 오래 걸리지 않으니, 체력이 약하거나 등산을 싫어하시는 분들도 오를만하답니다.",90,3667,2016/01,4,겨울
송악산,제주도 서쪽의 끝봉우리~,마라도선착장근처~올레길~제주의 몇 안되는 산중에 송악산이 있다.산책보다는 약간의 등산개념으로 출발하시고~ 아름다운 바다와 마라도 관광과 산방산 방문등의 관광지가 많은 곳이기도 하다.,90,3668,2015/11,5,가을
송악산,송악산은 중간까지만 아름다운 걸로,송악산 끝까지 올라가다가 무서워서 죽는 줄 알았어요. 딱히 안전장치가 안되어 있구요. 중간까지 가는 길은 굉장히 예뻐요. 거기서 멈췄어야 했는데 끝까지 다 올라가서는 위험해서 다리가 후들거렸어요. 겁이 많으신 분들은 꼭대기까지 가는 것을 추천하지 않습니다.,90,3669,2015/11,5,가을
송악산,소문난 해안도로와 절경을 볼 수 있는 장소,"제주도 서부에 위치한 송악산은 산방산에서 송악산 초입까지의 경치가 너무 좋기로 소문난 해안도로랍니다. 그 길을 달려 조금만 가면 송악산입니다.

송악산 정상에 오르면 누구나 감탄사가 절로 나오는 곳이죠.

앞으로 가까이 보이는 최남단의 마라도와 가파도, 형제섬, 우뚝 솟은 산방산, 멀리 보이는 한라산, 그리고 끝없는 바다를 볼 수 있는 곳으로 꼭 가봐야 하는 장소로 추천해 드립니다.

당연히 자연을 감상하는 곳이라 무료 입장입니다.",90,3670,2016/05,5,봄
송악산,송악산둘레길,"송악산둘레길 관광객이 무지 많더라고요
경치도 좋고, 저 멀리 섬도 보이고, 산방산도 보이고,
바다도 있고
너무 좋더라고요",90,3671,2016/06,4,여름
송악산,3번쨰 방문,"이름은 산이지만 오르기 적당한곳 같아요.
길도 잘되어있고 올라가면 바다가 한눈에 보여서 탁트인 전망이 멋있습니다.",90,3672,2015/08,5,여름
송악산,수차례 제주 방문중 처음 온곳,"송악산!!
10여차례의 제주 방문중
송악산은 기억에 없는 곳중의 하나
어렸을때나 학창시절 수학여행 때
지나쳐 갔을래나?
확트인 바닷배경과 멋진 경치가 있는곳",90,3673,2016/03,4,봄
송악산,최고~^^,송악산 꼭 가보고 싶었는데.. 너무 좋았어요~ ^^ 천천히 주위 구경하면서 올라가시면 좋을 것 같습니다! 저멀리 산방산도 보여요^^,90,3674,2016/02,5,겨울
송악산,낮보다 밤이 더 멋진 곳!,"제주도에 가면 거의 반드시 들리는 곳인데요

관광객들이 해안도로를 따라가다 많이들 그냥 지나치는곳이예요

낮에가면 정말 탁트인 전망에 속이 다 시원해지구요 산방산을 배경으로 다들 인증샷 찍고 있답니다

입구쪽에 간단히 먹거리도 팔구요~

그런데 여기 진짜 매력은 보름달이 환할때 보는 야경인것 같아요

달빛에 비치는 바다는 낮에보는 풍경보다 수십배는 멋지구요 벤치에 앉아서 밤바다를 보며 한잔하는 캔맥주는 정말 최고랍니다!!!",90,3675,2015/08,5,여름
송악산,올레길 10코스의 하이라이트,"산방산에서 송악산으로 이어지는 자전거도로(약4km)는 꼭 가볼만한 곳입니다. 걸어도 좋고, 자전거를 타도 좋습니다. 이맘때쯤 간다면 노란 유채꽃밭이 끊임없이 나타나고, 송악산 근처에서는 평화롭게 초원을 거니는 말들도 구경할 수 있습니다.",90,3676,2016/03,4,봄
송악산,가장 좋았던 기억,"큰 기대를 안 하고 갔는데 많이 좋았습니다.
아이랑 함께 가서 한 바퀴 도는데 1시간 넘게 걸리긴 했는데 덕분에 더 천천히 주변 보면서 산책할 수 있었네요. 바다쪽으로 보이는 모습 뿐만아니라 송악산 산의 다채로운 모습도 좋았어요. 산책길 끝에 있는 소나무숲길도 정말 멋졌어요",90,3677,2016/03,5,봄
송악산,풍경죻죠,산방사도 있고 근처 커피숍도 많아요. 용머리 해안도 근처에 있어서 같이 돌기 좋습니다. 모슬포 쪽 필수코스죠,90,3678,2015/04,5,봄
송악산,독특한 제주해변,"독특한 제주해변을 즐기기에 아주 좋은 곳. 걷는 것을 좋아하지 않는 일행이 있는 경우, 드라이브 코스로 강추!",90,3679,2015/06,5,여름
송악산,송악산 올래길,아침에 송악산 올레길을 따라서 걸으면서 바라보는 바다는 색다른 느낌입니다. 올레길을 따라서 예쁜 카페들도 많이 생기고 있습니다.,90,3680,2015/11,4,가을
송악산,제주올레 9코스,9코스 근처 산입니다. 그런데 주변에 공사가 한참 진행중이어서 막혀있는 곳이 많이 있습니다. 작은 봉우리인줄알고갔다가 큰 산이라서 좀 놀랐는데 능선을 따라 한번 걷기 좋습니다.,90,3681,2015/12,4,겨울
송악산,송악산의 해안도로!!,자전거를 타고 산방산~용머리해안~송악산까지 갔습니다. 속이 뻥 뚫릴 것 같은 기분과 함께 멋진 풍경이 아직도 머리에 생생합니다...,90,3682,2015/11,5,가을
송악산,아름다운 송악산,11월 30일 방문했는데 너무 따뜻한 날씨와 햇살이 이 곳을 더 아름답게 했습니다. 낮은 언덕에 길도 잘 되어 있어서 모두 어려움 없이 오를 수 있습니다. 중간 중간 말도 보이고 푸르른 바다와 산방산이 경치를 더 해줍니다. 주차장도 무료니 한 번 방문해보세요.,90,3683,2015/11,5,가을
송악산,아주 좋은 곳,아주 좋은 곳이지만 접근성이랄까.. 돌아다니는 것이 쉽지는 않습니다. 하지만 산책로의 풍광은 아주 좋아요.,90,3684,2015/11,5,가을
송악산,탁트인 바다의 전망을 보기 좋은 곳,"산방산과 송악산 사이 해안도로 드라이브가 멋진 곳이며, 올레길을 걷기에도 전망대에서 바라보기에도 멋진 곳입니다. 날씨가 좋은 날 한없이 펼쳐지는 바다를 바라보면 가슴이 탁트이는듯한 멋진 풍경을 만날 것 입니다.",90,3685,2014/12,5,겨울
송악산,경치가 장관을 이루는 곳,제주 송악산은 너무나 아름다운 경치로 유명한 곳입니다. 근처에 맛집도 많아서 식사한 후에 송악산 주변을 산책하는 것도 좋을 것 같습니다.,90,3686,2015/05,5,봄
송악산,절벽위의 오름,제주도에서 가장 아름답고 아픈 오름이라고 누군가 말했다. 해변에 자리한 오름이라 그런 느낌이 드는 것 같다. 날이 맑으면 저 멀리 마라도까지 보이고 올레길 10코스를 따라 멋진 지형을 볼 수 있는 정말 아름다운 곳이다.,90,3687,2015/09,4,가을
송악산,송악산 둘레길 좋아요,송악산 둘레길 산책했어요. 자연풍경이 바다와 잘 어울러져 산책하기 좋아요..근데 지리적으로 떨어져 있어 동선상 가기가 좀 힘드네요,90,3688,2015/10,5,가을
송악산,올레10코스에 들어가 있는 산,산이라기 보다는 오름이에요 실제로 근방의 산방산과 송악산 둘다 오름인데 산이라는 이름이 붙었다 하더라고요 높지 않고 원만한 능선이 있어서 힘들지 않게 오를 수 있습니다 바다와 들을 함께 즐기는 경관을 볼 수 있고요 바다 건너 가파도와 마라도가 보입니다 바다색이 아주 시퍼렇게 예뻐요 산에는 등산로를 잘 만들었는데 종종 말이나 동물이 돌아다녀서 약간 무섭습니다 말똥 주의하세요,90,3689,2015/02,5,겨울
송악산,좋아요,"송악산을 따라 드라이브를 하면 참 좋죠
해안도로를 달리며 산까지 탈 수 있으니 최고 같아요",90,3690,2015/08,5,여름
송악산,송악산 앞에서 마시는 커피,"송악산 멋져요. 제주도 어디든 그렇지만 바람이 좀 많이 부는 날에 가서 밖에서 즐기기엔 어렵고, 근처 커피점에 가서 커피 마시며 풍경 바라보니 좋았습니다.",90,3691,2015/06,4,여름
송악산,아픈 역사를 갖고 있는 곳,"아름다운 바다와 시원한 바람이 어우러진 곳이다, 그러나 원래 아픈 역사를 간직한 곳이라 윗세대들에게 감사하고 미안한 마음도 동시에 드는 곳이다. 아이들 교육상 방문하기에도 좋은 곳이라 생각한다",90,3692,2015/09,4,가을
송악산,제주 송악산,바람을 맞으며 등산? 트래킹을 할 수 있는 곳입니다. 전망은 좋아요. 하지만 나무가 없어 여름철에는 더울수 있어요,90,3693,2015/01,4,겨울
송악산,절경과 낙조가 좋은 곳,"제주에 올레길이 많지만, 해안을 따라 걷는 송악산올레코스가 참 좋습니다. 형제도를 바라보며 힘들지 않게 걸을 수 있는 길이에요. 다른 올레와 달리 한바퀴 돌면 출발점으로 돌아올 수 있어서 좋습니다.",90,3694,2015/03,5,봄
송악산,간단한 운동화를 신고 송악산을 오르자.,"놀멍쉬멍걸으멍에 걸맞는 적당한 산!
위치가 다소 떨어져서 대중교통으로는 어려움이 있으나
꼭 한번 가보기를 추천하는 장소!
그리고 시간을 내어서 올라야하는 산 오르면 분명히
감탄할 전경이 펼쳐짐 특히 형제섬의 모습은 아름다움",90,3695,2015/09,5,가을
송악산,송악산,날씨 좋은날은 경치 정말좋습니다 올라가면 마라도 가파도 볼수있구요 30분~1시간정도 산책코스로 좋아요,90,3696,2015/06,5,여름
송악산,방문기,"제주의 자연은 떼묻지 않은 모습을 느낄 수 있어 좋은데, 해변가를 따라 산책할 수 있고, 약간 언덕을 올라 조망할 수 있는 분화구 등이 아름답습니다.",90,3697,2015/07,4,여름
송악산,멋진 풍경 송악산,송악산 너무 멋집니다. 마라도 가기전 아침에 송악산에 들려 아름다운 경치를 둘러보면 좋을 것 같습니다.,90,3698,2015/08,4,여름
송악산,정말 좋아요~,"제주도에서 다시 가고 싶은 곳중 하나입니다.
경관도 너무 좋고 ~
둘레길처럼 쭉 걸으면 너무 상쾌해요~
다시가고 싶네요",90,3699,2014/12,5,겨울
송악산,송악산둘레길 굿굿!!!,"송악산 둘레길을 걸으면 제주도의 남쪽 바다를 시원하게 볼 수 있어요 가파도도 보이고 마라도도 보이고 산으로 눈을 돌리면 방목 하는 말들도 볼 수 있어요.
산과 바다를 동시에 만끽할 수 있는 최고의 산책길! 단 송악산 등반은 생각보다 미끄럽고 험한 편이에요 산은 높지 않지만...",90,3700,2015/03,4,봄
송악산,송악산 가는 길!,"제주도 서남쪽에 위치한 송악산,
우리나라 최남단인 마라도가 보이고 청보리의 천국 가파도의 보입니다.
쾌청한 날씨에는 멀리 한라산이 우직하게 솟은 모습까지 감상이 가능합니다.

꼭대기에 2중 분화구가 있습니다.
분화구를 올라가셔도 좋고 분화구를 둘레로 돌아봐도 좋습니다.
제주도의 여느 오름과 마찬가지로 오름을 오르는데 큰 시간이 소요되지 않습니다.
하지만 그 위에서 바라보는 경관만큼은 큰 차이가 있습니다.
오름마다 날씨에 따라 보이는 풍광, 매번 다릅니다.
이것이 제주의 가장 큰 매력입니다.

# 상세사항
주소_서귀포시 대정읍 상모리 131
문의_064-120
기타_시기에 따라 오름의 입산이 통제되기도 합니다. 자연보호 차원에서!
가는 방법_바로 가는 버스가 있긴 한데 951번, 하루에 4회 운행,
시간만 잘 맞추면 다행이지만 안 그럼 걸어가거나 택시를 타셔야 합니다.
택시를 타면 일괄요금으로 6천원 정도 받습니다.
걸어가는 길은 올레길과 해안도로, 두 가지 방법이 있는데
두 길 모두 1시간~ 1시간 15분 내외로 소요, 올레길이 좀 더 돌아갑니다.",90,3701,2015/02,5,겨울
송악산,아름다운 경치,"우리는 이 곳을 사랑한다. 연중 지속되는 아름다운 경치에 명확하게 표시된 산길, 볼만한 잠수함, 드라마틱한 암석단애, 승마체험 가능한 말까지.",90,3702,2013/05,5,봄
송악산,송악산은 아름답다!!,"송악산은 높지 않아서 가족동반한 아이들도 오를 수 있다. 그리고 경치도 아름답다.
날씨가 맑으면 바다쪽으로 송악산과 한라산을 볼 수 있다.",90,3703,2013/05,5,봄
용머리 해안,용머리르 닮아서 용머리 해안입니다.,용머리르 닮아서 용머리 해안입니다. 주변에 사실 볼거리는 없습니다. 다만 제주시와 가까워 제주시에서 노실때 한번 들리면 좋을 것같습니다.,91,3704,2016/05,5,봄
용머리 해안,가족방문기,"언제 가서 봐도 아름답습니다
하멜표류기가 있다면
최부의 표해록이 있다는것을 알고
제주 곳곳에 흔적을 더 알렸으면 합니다",91,3705,2016/12,5,겨울
용머리 해안,멋진 경관을 볼 수있는곳,"3번째 방문만에 드디어 입장이 가능했던 용머리해안.
처음에 모르고 방문 후 입장유무를 알았는데요 산방산관리공단에 전화하시면 당일 개방유무 알 수 있습니다.
내려가는 입구 및 해안가를 걷다보면 정말이지 바다와 무척 가까이 있어서 바람이 세거나 기상이 안좋으면 입장불가한 이유를 알 수 있어요
입장료는 2000원인데 워낙 싼 입장료이기도 하지만 절경을 보자니 정말 돈이 아깝다는 생각을 할 수 없는 곳이었어요",91,3706,2016/12,5,겨울
용머리 해안,경치가 아름답지만 아무때나 갈 수 없음,"파도가 심하거나 바람이 심하게 부는날은 입장이 불가하기 때문에 반드시 확인을 해보고 가야한다
바위위로 걸어다니기 때문에 편안한신발을 갖춰야 즐기기 편하다 개인적으로 제주도에서 아주 좋아하는곳",91,3707,2016/08,4,여름
용머리 해안,해안 절경이 너무 멋진곳,"단순한 해안으로 생각하고 갔는데 기이한 바위 모양에 너무 인상적인 장소였음.
바다쪽으로 생겨난 절벽과 바위들의 모양을 신기해 하면서 한바퀴 돌아보는 코스입니다.
파도가 치는곳도 가까운 곳에서 볼 수도 있습니다.
입장료가 어른 2000원 아이 1000원을 받지만, 그 이상의 값어치를 한다고 생각함.",91,3708,2016/09,5,가을
용머리 해안,공항가기전에 잠깐!,"특별한 건 없습니다. 잠깐 서서 제주도에서 만든 추억 정리하고 아이들이랑 뭐가 좋았나 애기하면 됩니다.

다리가 흔즐거려서 재밋구요.",91,3709,2016/09,4,가을
용머리 해안,산방산에서 바라본 멋진 풍경,아름답게 깍여진 절벽이 절경을 자아낸다. 상상력을 조금 보태면 정말 용처럼 생기긴했다. 너울거리는 파도와 현무암이 만들어낸 자연의 신비를 느낄 수 있는 곳이다.,91,3710,2015/10,4,가을
용머리 해안,멋진곳이 바로 여기 한국 같지 않은 한국,"이곳을 한국이라고 한다면 믿겠나요.? 제주도 용머리 해안 입니다.
날씨에 따라 들어갈 수도 못들어 갈수도 있으면 모슬포의 간조 만조 시간에 영향으로 들어가거나 못들어갈수 있습니다.
한국의 그랜드 캐니언 그곳으로 가보세요.",91,3711,2016/09,5,가을
용머리 해안,한국의 그랜드캐니언이라고 불리는곳,"사진찍기에도 좋고 주변경관도 좋습니다.
연계관광할 것도 있고요 하지만 비, 바람 등 날씨에 따라서 입장불가가 될 수 있으니 꼭 미리 확인해보세요",91,3712,2016/05,4,봄
용머리 해안,용이승천하는 모습의 해안~,"용이 누워있는 모습의 아름다운 해안도로의 모습을 보여주는 곳으로 해안을 한바퀴돌면서 바라보는 모습은 절경을 자랑하는 곳입니다,",91,3713,2015/08,5,여름
용머리 해안,날씨 잘 맞춰서 가야 하는 곳,"산방산에서 바라보면.. 전망은 정말 엄지 척!
전망이 너무 멋있으나
날씨가 흐리면.. 아무것도 보이지가 않아 헛수고 하게 됨.",91,3714,2016/07,4,여름
용머리 해안,#용머리해안,"""한국의 그랜드캐니언""이라는 말이 무색하지않을 정도로 경관이 멋집니다.
80만년 전 생성된 것으로 응회암으로 이루어져있구요,
울퉁불퉁한 길을 걷다보면 해녀들이 직접따온 멍게, 해삼등도 판매합니다.한접시 이만원^^소주 사천원^^
단, 바다물때를 확인 후 물이빠져있을때 가셔야 관람가능합니다
기상 악화시에는 출입통제.
그리고 입장료는 1,000원
단체 700원
제주도민 무료
-끝-",91,3715,2016/07,5,여름
용머리 해안,기대보다 멋집니다!,제주도에 여러번 갔었는데 왜 이제온걸까 싶을정도로 멋졌습니다. 사실 입구에 조잡한 조형물들이 망한 유원지같았거든요.. 그런데 매표하고 들어가니 신세계! 흐린날이었지만 신비롭고 멋졌습니다,91,3716,2016/07,5,여름
용머리 해안,날씨 좋은날 정말 아름다운 곳,"바다 바로 옆을 걸으니 경관이 아름다운건 말할것도 없고
맞은편 산쪽으로는 산방산 보문사 등 절도 있어서 가보면 너무 좋습니다.",91,3717,2016/06,5,여름
용머리 해안,너무너무 멋있어요,"날씨가 다행히 너무 좋아서 용머리해안을 둘러볼수있었어요!
가는 해안도로도 너무 좋고요!
용머리 해안은 더 좋고요!",91,3718,2016/06,4,여름
용머리 해안,용머리해안의 풍경~ 멋집니다.,"저렴한 입장료로 멋진 풍경을 볼수 있지만, 날씨가 좋지 않으면 들어갈수 없습니다.
주위에 하멜 박물관이 있지만 들어갈 만한 곳은 아닌거 같네요.",91,3719,2016/04,5,봄
용머리 해안,용머리 해안,날씨가 좋아야 용머리 해안을 둘레둘레 볼 수 있어서 때마다 갈 수 있을 지 없을 지 달라요 날씨 좋은 날은 으뜸입니다,91,3720,2016/02,5,겨울
용머리 해안,바람 세요!,"바닷바람이 매우 쎄고 중국인들이 많이 오는 곳으로, 해산물에 소주한잔 먹을꺼 아니면 그닥 추천해드리고 싶지 않네요",91,3721,2016/04,3,봄
용머리 해안,용머리 해안,산방산에 있는 용머리 해안은 날씨가 좋아야 하고 썰물 밀물 때를 맞추어야 관람 할 수 있다. 하멜 기념탑에서 보는 해안 풍경은 날씨가 좋을 때 마라도 까지 잘 보인다.,91,3722,2016/03,3,봄
용머리 해안,이국적인 풍경,풍경이 너무 신기하고 멋져서 깜짝 놀랬습니다. 날씨가 좋지 않으면 개방을 안할수도 있으니 주의해야 합니다. 주상절리와 더불어 제주도에서 가장 인상깊은 곳이었습니다.,91,3723,2016/02,5,겨울
용머리 해안,용머리해안 최고입니당,용머리해안.....너무 좋습니당 그리고 근처에 유채꽃도 피어있어서 사진도 진짜 예쁘게 나와요~~~ 맛있는것도 많이 팔고 가는길에 말타는 체험도 있고 너무 좋습니당,91,3724,2016/03,5,봄
용머리 해안,날씨에 따라 다르지만 좋습니다,"날씨가 나쁘면 아예 출입이 불가할 때도 있지만
신기하고 탁트인 풍경 너무좋습니다
용머리 해안 입구에 있는 인스타에서 유명한 치치퐁
곧 이사간다고 가끔 문을 닫을 때가 있어서 저는 못먹었습니다ㅠㅠ",91,3725,2016/04,5,봄
용머리 해안,공항근처 관광지,"공항근처라 첫날이나 마지막날 한번씩 방문하는 듯 합니다
정말 용머리같은 바위가 있지만 시간이 넉넉하지 않다면 패스해도 될 듯해요
사진 찍는 포인트는 관광객으로 가득 차있어요",91,3726,2015/07,3,여름
용머리 해안,용머리 해안 제주도 필수코스~!~,용머리 해안이라고 해서 별거 없을줄 알았는데 막상가보니 바다와 돌의 경치가 아주 좋았습니다.,91,3727,2015/09,5,가을
