한라산 국립공원,최고의 트레킹코스,영실코스를 다녀왔습니다. 관음사코스에 비해 난이도가 낮아서 누구나 올라갈 수 있는 코스입니다. 실제로 어린이를 동반한 가족단위 등반객을 많이 만났습니다. 영실코스는 윗세오름까지만 오르고 백록담에는 오를 수 없지만 오르는 동안 주변 경치가 아주 수려해서 전혀 지루하지 않고 멋진 트레킹을 즐길 수 있는 장점이 있습니다. 그리고 윗세오름 휴게소에서 먹는 육개장컵라면이 아주 별미입니다.,15,1282,2015/07,5,여름
한라산 국립공원,1950m 절경,"성판악 1월14일 아침 7:30분 주차장 차 풀...도로에 세워둠...
완전무장후 출발,,,처음부터 누니있어서 아이젠착용,,양쪽 눈밭길,,사람 많음,,사라오름까지 완만 ,,,휴게소에서 바나나한개 먹고 , 다시 출발,,정상1km전 윗쪽으로 눈보라,,히말라야 보는듯,,ㅋ
정상 백록담 비석에 사진 찍으려 줄섬...백록담 사진촬영은 보기 힘든데 사진 찍고 ,,하산......지루한 하산길,,,,,
왕복 8시간의 긴 여행...걷기만 잘하면 등정 가능,,인내를 가지고..,먹을것 많이 가지고 등정,,,,",15,1283,2016/01,5,겨울
한라산 국립공원,제주 최고의 명소,한국의 남쪽에서 가장 높은 산. 아름다운 풍광과 백록담에 올랐을 때의 감동은 잊혀지지 않습니다. 단연코 제주도의 상징이자 최고의 명소!,15,1284,2015/10,5,가을
한라산 국립공원,겨울에는 입산 시간이 정해져 있습니다.,"오후에 도착했는데, 입산 금지 되었습니다.
겨울에 가실땐 입산 가능한 시간을 꼭 확인하시고 가세요.
입구까지 밖에 못갔지만, 저번 제주 방문때 갔는데, 좋습니다",15,1285,2015/12,4,겨울
한라산 국립공원,눈꽃이 예쁜 한라산,"눈이 소복히 쌓인 날 방문한 한라산.
가는 길이 미끄럽기도 했지만, 아침부터 등산객들로 인산인해였다.
그리고 한라산 눈 쌓인 한라산 풍경은 여기가 히말라야인가 싶을 만큼 멋졌고 눈꽃 핀 나무도 아름다웠다.

여름의 한라산도 매력있지만,
겨울의 눈 온 한라산은 정말 멋진 듯!!!",15,1286,2015/01,5,겨울
한라산 국립공원,백록담을 바라보며,부모님과함께 올랐던 한라산.여러가지 코스중에서도 제일 완만한곳을 선택하여갔는데 평소 운동을하지않는나에겐 정말 힘들었습니다.이를 악물고 정상에 도착하여백록담을 바라볼땐 가슴이 뻥 뚫리고 리프레쉬를 할수있는기회가되었습니다,15,1287,2015/01,5,겨울
한라산 국립공원,한라산 국립공원,"언제나 아름다운 한라산, 하지만 사람들이 너무 많이 올라가서 산이 무너져 내리지 않을까 걱정이다..",15,1288,2015/09,4,가을
한라산 국립공원,너무나도 아름답고 너무나도 행복한 자연,"말이 더 필요없다.
자연은 너무 아름답고 산책로는 배려심 가득하게 만들어져 있다.

다양한 루트가 있어 초심자 여자 아이 도 충분히 등반이 가능하다.
도시락을 먹거나 쉬어갈 수 있는 구간도 많고
자연이 너무나 아름답다.

아쉬운 점은 오르는 길 보다 위험한 내리는 길이다.실제로 수학여행 중 넘어져서 다치는 여학생도 보았고 못이나 나무가 부러져 있어 산책로가 위태로운 부분이 종종 있었다.


다른 다양한 루트로 꼭 재방문 하고싶다.
그리고 각 길마다 열고 닫는 시간이 제한되어 있기 때문에
아침일찍 출발하는 것을 추천한다.",15,1289,2015/11,5,가을
한라산 국립공원,1100고지 드라이브를 추천합니다.,한라산은 보고픈데 등산은 힘들다 하시는 분은 1100고지 드라이브를 추천해드립니다. 특히 설경이 너무나도 멋져요~ 겨울왕국이 있다면 한라산인 것 같아요~ 대신 스노우체인을 채우진 않아도 되는 생황이더라도 트렁크에라도 스노우 체인이 있어야 올라갈 수 있구요 경차는 못올라가게 저지당할 수도 있다는거 알고계셔요~,15,1290,2015/01,5,겨울
한라산 국립공원,힘들지만 멋져요,꼭대기까진 못 갔지밀 가는 길이 참 멋져요. 눈꽃을 그때 처음보고 반했어요. 가족끼리 함께 올라가서 라면 한 그릇 뚝딱하면 좋을 듯 합니다.,15,1291,2014/12,3,겨울
한라산 국립공원,설경이 정말로 멋진 곳 입니다.,"겨울 한라산은 눈이 1미터 가까이 내리는 곳이라
설경을 구경하기에는 정말 제격인 곳 입니다.
눈에 쌓인 백록담이 인상 깊었습니다.",15,1292,2015/11,4,가을
한라산 국립공원,단풍과 낙엽이 감동적,영실에서 올라가서 영실로 내려왔습니다. 혹시 비가 오면 우의나 방한복을 반드시 준비해야합니다. 겨울철에는 아이젠도 필요합니다. 단풍이 절정이어서 무척 좋았습니다.,15,1293,2015/11,5,가을
한라산 국립공원,한라산(백록담)을 바라보며^^,"13년 여름, 14년 겨울, 15년 가을에 한라산을 올랐습니다.
내년에는 봄에 산을 올라 사계절의 절경을 꼭 보려고합니다.
날씨 변화가 심한 산중에 하나이지만 그 경치 만큼은 따라올
산이 없다해도 과언은 아니다라는 생각을 하게 만드는 산입니다.
산을 좋아하시는 분들 한라산으로 '혼저옵서예'",15,1294,2015/10,5,가을
한라산 국립공원,최고의 산,"일정상 짧은 코스인 영실코스를 올랐는데, 최고의 경험이었습니다. 윗세오름에서 바라보는 풍경이 정말 멋져서 다음에는 다른 코스도 도전해보려고 합니다. 단, 새벽에 주차장까지 가는 길이 너무 어두워서 혹시라도 사고가 나지 않을까 무서웠습니다.",15,1295,2015/11,5,가을
한라산 국립공원,한라산은 최고죠,사계절이 다 아름다운 한라산은 언제 가 도 참으로 절경입니다...바다만 좋아하던 제게 산의 아름다움을 눈뜨게 해 준 산이 바로 이 곳 한라산 영실입니다....,15,1296,2014/11,5,가을
한라산 국립공원,설명이 필요 없는 한국의 명산.,"사계절의 특징이 뚜렷하여 언제든 등산의 풍미를 새롭게 느낄 수 있는 곳. 정상 방문도 좋지만 영실.어리목, 돈내코 코스를 이용한 윗세오름 휴게소까지의 산행도 좋은 곳.",15,1297,2015/10,5,가을
한라산 국립공원,한라산,한라산 국립공원은 제주 여행에서 꼭 가봐야 할 곳 중 하나이다. 제주에서만 자생하는 많은 식물과 잘 보존된 산라락을 보고 있으면 황홀하다. 고산지대로 올라갈 수록 날씨가 급변하기에 복장을 잘 준비해서 오르기를...,15,1298,2015/08,5,여름
한라산 국립공원,백록담정상 산행 적극 추천합니다.,"산행의 묘미를 느낄 수 있었다.,낮게 깔린 구름과 세차게 불어오는 바람.,탁 트인 전망을 볼 수 있는 백록담.,온갖사람들의 수다.,황홀함 등",15,1299,2015/07,5,여름
한라산 국립공원,다음엔 꼭 백록담에 도전~~,어승생악으로 윗세오름까지 오르려고 했는데 두 아이와 저질체력인 제게는 무리수였어요. 하지만 사제비동산까지 숲길을 헤치고 가다가 하늘이 탁 트인 곳에 이르렀을때는 불어오는 바람에 땀도 식고 제 마음도 시원해졌습니다. 만세동산까지밖에 못가서 아쉽습니다.,15,1300,2015/09,5,가을
한라산 국립공원,아름다운 산,"겨울 눈꽃등산을 다녀왔습니다.
말할것 없이 아름답고 멋있었습니다.
다른계절에 다녀와도 정말 좋을것 같습니다.",15,1301,2015/01,4,겨울
한라산 국립공원,5번을 가도 지겹지 않은 곳,"정말 갈 때 마다 새로운 곳에 당도한 느낌이다.
마법같은 섬에 위치한 너무나 멋진 산
누구랑 가느냐도 중요하겠지만 겨울에 간다면 새로운 모습의 대한민국을 느낄 수 있다.
강추하는 곳",15,1302,2014/12,5,겨울
한라산 국립공원,우리강산,"산이 굉장히 아름답고 산을 좋아하는 사람은 꼭 가보시기를
완전강추합니다. 우리나라는 4계절이 확실한 곳입니다.",15,1303,2015/03,3,봄
한라산 국립공원,윗새오름에서 본 한라산,윗새오름으로 오르면 경치가 좋다는 소문만 듣다가 이번에 방문하고 보니 정말 좋더라고요. 힘들지 않은 코스이기에 가족단위로도 추천합니다.,15,1304,2015/09,5,가을
한라산 국립공원,최고의 명산 맞습니다,최고지요.코스도 여러곳이고 성판악&관음사코스를 가장 많이 이용하는데 힘들지만 중간의 경치가 잠시 힘듬을 잊게 만들어요.진달래 대피소에 1시전에 도착하셔야 하니 아침부터 부지런히 올라가셔야합니다.,15,1305,2015/08,5,여름
한라산 국립공원,한라산 백록담...,"태풍 후 등산이라 백록담의 물이 고인것도 보았고,
3대가 덕을 쌓아야 본다는 백록담을 직접 보니 말로는 이야기 할 수 없는...
정말 좋았던, 하지만 정말 힘들었던 등산",15,1306,2015/08,5,여름
한라산 국립공원,한라산 등산 강추,"4계절 언제가도 늘 좋습니다.
겨울에 특히 아름다운데 기상여건에 따라 방문에 제한이 있어서 아쉽지만 그래도 정말 아름다웠어요.",15,1307,2014/12,5,겨울
한라산 국립공원,한라산완전정복,성판악에서 시작하여 관음사로 내려오는 한라산 등반일주는 약 8시간 18KM코스로 큰 무리 없이 아름다운 경치를 보면서 산행할수 있는 강추 코스입니다. 겨울철의 모습이 개인적으로 더 좋왔음,15,1308,2015/04,5,봄
한라산 국립공원,영실-윗세오름~,영실-윗세오름 코스로 등반했습니다. 날씨가 더웠지만 바람이 너무 시원했어요. 끝없는 계단을 따라 등반하는 코스로 무릎이 안좋으시다면 다른코스로 추천해요~ 올라갔다 내려올때 고통스러울수도 있어요 ㅋㅋ 이코스는 불행이도 백록담에는 갈 수 없는 코스입니다. 백록담을 원하신다면 성판악코스로 가시면 되요. 비록 백록담은 못봤지만 너무너무 좋았어요~^^,15,1309,2015/06,5,여름
한라산 국립공원,늘 신비롭고 새로운 트래킹 여행지,고도에 따라서 생물 종도 다양하고 오름마다 개성이 있어서 여러번 가도 질리지 않는 늘 신비롭고 새로운 트래킹 여행지,15,1310,2015/06,5,여름
한라산 국립공원,"신선이 된 듯 한 기분, 너무나 멋진 곳",영실코스를 따라 올라가면 안개 속에 갇히기도 하고 안개 위를 걷기도 하면서 신선이 된 듯한 기분이 느껴짐. 산길도 잘 정비되어 있어 전문 등산장비 없이도 누구나 산행이 가능해요. 운 좋으면 노루도 보이고 여러 동물들을 만날 수 있습니다,15,1311,2015/07,5,여름
한라산 국립공원,Best place in Jeju island (If you like mountain),"아시아 여행지에서도, 한국 내 여행지에서도 제주도의 순위가 왜 이렇게 낮은가 했더니 제주도, 제주시, 서귀포시가 나뉘어있기 때문인 것 같군요. 하나로 합친다면 순위가 많이 올라갈 듯한데요.

어쨌거나 제주도의 그 많은 명소 중에서도 최고는 단연 한라산 등반이었습니다. 특히 어리목 코스로 올라가 영실 코스로 내려오는 루트를 1순위로 추천합니다. 시간도 많이 안 걸리고, 힘도 덜 들고, 무엇보다 영실 코스로 해가 서서히 질 때쯤 하산하면서 마주하는 풍광은 가히 제주 최고입니다.",15,1312,2014/10,5,가을
한라산 국립공원,우리의 명산,"언제나 기분이 좋은 산입니다.
여러 등산 코스가 있지만 어리목을 주로 가게 됩니다. 초보자에게도 편한 곳이라고 생각이 되어서요. 어느 계절에 가도 좋지만 역시 조금 선선할 때 가는 것이 좋은데 높이 올라가면 좀 춥기도 합니다",15,1313,2015/07,5,여름
한라산 국립공원,한라산,"힘들고 힘들고 또 힘들어요
너무 높아요ㅠㅠㅠㅠ
올라갈때는 진짜 너무 힘들지만
정상에 오르면 진짜 예쁘고 멋집ㄴ다
하지만 너무 힘들어요..
다음날도 힘들어요",15,1314,2015/04,3,봄
한라산 국립공원,천혜의 자연,제주도에 위치한 이산은 제주국제공항에서 1시간이내에 도착 가능합니다. 계절별로 다양한 자연환경을 느낄 수 있으며 높이에 따라 달라지는 생태계를 즐기는 것도 좋은 추억이 될 것입니다.,15,1315,2015/05,4,봄
한라산 국립공원,최고의 자연 경관,"대한민국에서 제일 높은 산이지만, 동시에 제일 아름다운 산 중 하나입니다.
정상으로 오르는 길은 ""성판악""코스와 ""관음사""코스 뿐이지만 ""영실, 어리목, 돈내코"" 코스에서의 경치도 아름답습니다.
아름다운 자연경관을 보는 것이 목적이라면 ""영실, 어리목, 돈내코""코스가 더 훌륭한 선택입니다.",15,1316,2015/05,5,봄
한라산 국립공원,한라산,"오늘 눈꽃이 가득 피었어요 코스가 아주 잘 정비되었고, 깨끗해요
제주의 한라산은 사계절이 뚜렸해서 봄이면 철쭉,진달래가 피고
가을에는 단풍이 장관이지만 겨울이면 은빛 세계로 변하지요.
유네스코 자연유산이기도 합니다",15,1317,2014/12,5,겨울
한라산 국립공원,대한민국서 2번째로 높은 한라산,새벽에 출발하여 등반을 해야 저녁에 내려 올 수 있는 국립공원이다. 차량을 이용하여 주변을 오름을 활용할 수 있지만 등반을 하려면 초보자들이나 중급을 상판악쪽으로 이동하여 등반하는 것이 용이하다 등산에 자신있는 분들은 반대편 급경사를 이용해도 좋은 것이다. 하지만 등반하는데 나무가 햇빛을 가려주지못하니 썬 크림이나 팔토시를 꼭 하고 물을 꼭 챙겨가서 먹기를 바란다. 화산암으로 이루어졌기에 정상에는 백록담이라는 연못이 있고 정상에 올랐을 때의 희열감이나 전망을 본 가람만이 알 수 있다,15,1318,2013/08,5,여름
한라산 국립공원,백록담의 만수를 한번에 봤어요,"날씨 변화가 많아서 잘 볼 수 없다는 만수를 한번에 봐었어요
산을 잘 못타는데 제일 긴코스로 가다보니 9시간이나 걸렸어요
산을 즐기시지 않는다면 오름쪽을 권하고 싶습니다.",15,1319,2013/09,5,가을
한라산 국립공원,제주도에서 한번쯤은 가봐야 할 곳!,"산을 타는 것을 즐겨하지는 않지만 그 유명함에 한번 시도해본 곳이다. 영실코스로 올라갔으며 어리목 코스로 내려왔다. 가장 쉬운 코스를 선택했고, 천천히 오른 곳이다. 하지만 몸상태가 좋지 않아 약간 오르기 힘들었다. 올라가면서 바다가 보이고 아름다운 산의 풍경에 마음이 맑아 지는 것 같았다. 한라산을 오르는 것은 시간 배분때문에 힘든데, 점심을 든든하게 먹고 이른 오후에 산을 오르는 것이 제일 좋을 것 같다. 너무 즐거운 시간이었고 다음에 또 한 번쯤은 가고 싶은 곳이다.",15,1320,2013/04,4,봄
한라산 국립공원,여러 모습을 가진 너무 아름다운 산,"영실 오름 코스로 올랐습니다. 숲 초지 정원 평원..... 높이에 따라 바뀌는 한라산의 모습에 경탄에 경탄을 하며 올랐습니다. 때론 웅장하고 때론 소박하며, 구름이 잔뜩껴서 인지 몽환적인 모습까지 보여주더군요. 제법 높은 코스이지만 오르는길 너무 잘되어 있어 어렵지 않게 오늘수 있어요. 꼭 가봐야할 곳 으로 추천합니다.",15,1321,2013/10,5,가을
한라산 국립공원,정비가 잘 된 하이킹 코스,"렌터카를 빌려 영실 코스로 가 산행을 했습니다. 나무로 된 길이 깔끔하게 정비가 되어 있어 쾌적한 산행을 할 수 있었습니다. 당일 날씨가 너무 좋아 멀리 있는 섬을 볼 수 있었습니다. 코스의 최고 지점인 윗새오름까지 약 2시간 정도 걸렸습니다. 윗새오름에는 화장실과 간단한 매점이 있었고, 거기서 꾸준히 잘 팔리고 있는 컵라면 (15,000원)을 먹었습니다. 천천히 왕복을 하는데 4시간이 걸렸고, 정말 좋았던 산행이었습니다! 다음에는 꼭 정상까지 가 보고 싶습니다.",15,1322,2013/04,5,봄
한라산 국립공원,그저 설경 뿐이었습니다,"눈이 너무 많이 내려 주차장에도 눈이 많이 남아 있었습니다. 여기에 관광지가 두 곳 정도 있었던 것 같았는데, 처음 갔을 때는 산 안에 있는 것 같았고, 이번에 갔을 때는 그냥 주차장처럼 보였습니다. 거기 사시는 분들도 와 계셨습니다.
한국은 겅도가 도호쿠 북부보다도 북쪽에 있는 것 같으니 겨울은 피해서 가시는 것이 좋을 것 같습니다.",15,1323,2012/12,3,겨울
한라산 국립공원,아이랑 같이 갔어요.,초등학생 6학년 아이랑 같이 등산했어요. 암벽이 많아서 운동화보다는 등산화가 더 좋을 것 같아요. 경치 아름다웠어요. 야생 사슴도 봤어요.,15,1324,2012/08,5,여름
한라산 국립공원,눈부신 한라산의 아름다움,지난 겨울에는 어리목코스를 올라봤는데 이번에는 영실코스를 통해 윗새오름까지 올라봤다. 무난한 코스고 시간도 많이 걸리지 않아 좋았고 무엇보다 한라산 등반코스 중 가장 아름답지 않을까 싶었다. 바다도 잘보이지만 멀리 서귀포 시내와 산방산도 지척으로 보인다. 그리고 영실코스 자체가 넘 아름다운 풍경을 가지고 있다는 것이다. 한 번 가봐야 알 것이다. 이제 한라산도 너무 많은 사람이 찾는다. 다소의 사람체증은 각오해야 할 듯. 특히 영실코스쪽은...,15,1325,2012/04,5,봄
한라산 국립공원,"올라갈 때 5시간, 내려올 때 4시간 반","7월에 제주도에 있는 한라산에 올라갔어요.

등산코스는 4개가 있는데, 그 중에 2코스 골라서 올라갔다 내려왔어요.

관음사 코스:
관음사-1.5km-그린굴-1.7km-탐라계곡-1.7km-개미등-1.9km-용진각-1.5km-정상

성판악 코스:
성판악3.5km-속밭-2.1km-사라악-1.7km-진달래밭-2.3km-정상

이런 코스를 올라갈 때 5시간, 내려올 때 4시간 반 걸렸어요.

등산로입구까지는 교통수단이 없어서 호텔에서 택시로...

택시 안에서 운전기사 아저씨가 ""옛날에 한라산에는 하얀 사슴이 있어서 신선님의 사슴이라고 불렸는데, 일본사람들이 전부 잡아 먹어버렸다""라고 하셨어요(땀).
대답하기 난감했어요^^;

어쨌든 등산로입구까지 택시로 가서, 거기서 도시락을 받고, ""13시까지는 정상에 도달해주세요""라고 들었어요. 저희들은 아침 8시부터 오르기 시작했지요.

한라산은 해발 약 2000미터로 한국에서 가장 높은 산이에요. '내 이름은 김삼순' 드라마에서 주인공 삼순이 올라갔던 산이죠.

처음에는 완만한데, 마지막 2시간정도가 돌이 굴러다녀서 걷기 힘들고 험했어요.
정상 부근에는 나무가 자라지 않아서 바람이 강해서 날아갈 것 같았어요.
그리고 드라마에서도 그랬는데, 정상은 폭풍우가 몰아쳐요(눈물).
사진 찍기도 힘들 정도로 서 있는 게 고작이에요.
가실 분들은 꼭 우의를 챙겨 가세요.

도시락을 먹고 싶어도 비바람을 피할 곳이 없어요.

그대로 서둘러 하산했어요.

올라갈 때랑은 다른 코스로 내려왔어요. 4시간 반

가장 좋아하는 분에게 추천해요.^^ 이야깃거리도 되니 ^^

어쨌든 '한국에서 가장 높은 산'이니까요.
제주도에는 그밖에도 '한국 최남단 섬'도 있어요.^^

아! 아저씨가 이렇게 말했어요.
""한라산은 겨울에 최고에요""",15,1326,2010/05,5,봄
아쿠아 플라넷 제주,제주도에서 가장 만족스러웠던 관광지,"우선 아이들과 함께해도 정말 좋은 곳이라고 생각했습니다. 업장도 매우 넓었고 볼거리도 풍부해서 시간가는줄 모를 정도, 직원들도 친절하고 내부에 푸드코트도 잘 꾸려져 있어서 끼니를 때우기도 좋았습니다.

돌고래쇼가 볼만하다고 하던데, 관람시간이 정해져 있으니 미리 확인하고 가시면 좋을 것 같습니다.

적극 추천합니다.",16,1327,2017/02,5,겨울
아쿠아 플라넷 제주,가족과 즐거운 시간,"수족관에서 가족과 함께 다양한 사진을 찍으면서 재미있는 구경을 할 수 있어요. KODAK 에서 사진을 찍어 주는데, 12,000원을 내면 웃기는 사진과 함께 종이 앨범을 줘요. 쇼는 그렇게 웅장하지 않아요.",16,1328,2017/01,4,겨울
아쿠아 플라넷 제주,수준높은 해양생물 전시관,상당한 규모의 수중생물 전시시설. 다양하고 다채로운 해양생물을 손쉽게 볼수있음. 공연장에서는 스토리가 있는 쇼를 볼수있으나 몰입도는 떨어짐 객석환경개선이 필요함. 주위의 바다뷰가 좋음 아이들에게 교육적으로 매우좋음. 규모면에서 상당한 크기를 자랑.,16,1329,2017/01,4,겨울
아쿠아 플라넷 제주,가족과의 여행,"가족과 같이 휴가로 방문한 곳이었습니다. 우리나라에서 이정도의 수족관 시설이 있었는지 몰랐습니다. 부산의 아쿠아리움은 비교하면 안될것 같습니다. 공연시간을 잘 맞추어서 가면 좋을것 같습니다. 해녀쇼, 돌고래쇼...",16,1330,2016/12,4,겨울
아쿠아 플라넷 제주,"멋진 쇼, 다양한 볼거리, 질낮은 음식","쇼는 멋졌다. 유치한 스토리를 1급 배우가 캐리하는 느낌? 왠만한 돌고래보다 주인공이 낫더라... 아쿠아리움도 멋졌고 아이들과 관람하기에 더없이 좋을 컨텐츠인 듯. 항상 사람이 붐비는 건 어쩔 수 없음...
카페테리아는 별로... 식사는 다른 곳에서 하시라",16,1331,2017/01,3,겨울
아쿠아 플라넷 제주,다양한 볼거리와 공연이 있어 좋아요.,공식 가격과 인터넷 할인가 차이가 많이 납니다. 인터넷 할인가로 이용하는게 좋을 것 같네요. 아이들이 좋아할 신기한 물고기와 생물들이 많이 있고 다양한 공연들이 있어서 시간이 금방 가네요.,16,1332,2017/01,4,겨울
아쿠아 플라넷 제주,어딘가 익숙한 수족관,오키나와 츄라우미 수족관에서 고래상어만 없는듯한 느낌.동선이나 디자인이 굉장히 비슷함. 아쿠아리움위주로만 관람해도 큰 문제없어보임. 푸드코트에서 성산일출봉이 보여서 위치는 탁월해보임. 돈내고 관람하는것치곤 나름 괜찮긴 하지만 직원들의 친절교육은 상당히 부족해보임.(월급이 적어서 그런가?하는 생각이 들정도) 아이들 동반가족들이 많은데도 배려심은 글쎄...시설이외에 기대하지 마시길. (아쿠아리움내에서 아이 잃어버린 엄마에게 말건네는 직원 없었음. 30분정도후 나왔는데 그때까지 방송도 없었으니 말다한듯),16,1333,2016/12,3,겨울
아쿠아 플라넷 제주,비오는날 가면좋은곳,"실내관광지가 별로없는 제주도라 그런지 비오는날 사람이 너무 많았어요.
오션아레나 공연은 서커스와 돌고래쇼를 합친 느낌인데 성인이 보기엔 지루한 느낌입니다.
수중터널과 나오기전의 큰 수조는 이뻤고 밖으로 보이는 성산일출봉 풍경이 아름다웠어요",16,1334,2016/12,4,겨울
아쿠아 플라넷 제주,제주여행중 비가온다면...ㅋ,"아쿠아 프라넷 제주...
내가 갔을때 유명한 고래상어를 방류한 후라 고래상어를 못봐아쉬웠지만 비가와서 일정이 꼬여버린 우리 일행에겐 더없이 좋은 여행지였다.
돌고래쑈, 상어, 가오리, 아쿠아리움안의 많은 물고기들도 구경하고 안에서 파는 고래상어빵도 사먹고...ㅋ(맛있음)
특히 아이들을 동반한 여행이면 꼭 들러도 좋을 여행지이다.
항공사나 렌터카 숙박업소에서 할인권도 많이 배포하고 있으니 이용하시면 저렴하게 즐기실 수 있고요...^^
기상이 변화 무쌍한 제주에서 어린이 노약자와 오랜시간 즐겁게 보내실수 있는 좋은 여행지네요~~^^
여름에는 안에서 숙박까지 할 수있는 상품이 있다던데...
다음에는 그것까지 도전해 봐야겠어요...
바다속에서 잠자는 것 같은 기분이겠죠??",16,1335,2016/05,4,봄
아쿠아 플라넷 제주,추천합니다.,"아쿠아리움을 많이 간 건 아니지만 해외의 어지간한 곳보다는 잘 되어 있습니다. 기왕이면 시간 잘 맞추어 해녀, 돌고래 공연 등을 보길 추천합니다. 어린이들이 있으면 아주 좋아할 거라 생각합니다.",16,1336,2015/12,5,겨울
아쿠아 플라넷 제주,여수 가봤다면 그냥 그래요,"잘해놓고 신기한건 맞는데
여수보다 규모가 크다 그래서
기대하고 갔는데 그냥 그랬어요.
사이언스인가 그것때문에 규모가
크다 한건가;;;;
여수 가봤으면 또 가볼 필요는
없는 것 같습니다.
대형 수족관 옆 커피숍에서
커피 마시면서 구경하는 건 좋았습니다.",16,1337,2016/11,3,가을
