정방 폭포,폭포는 멋있으나 계단은 잔인하다,"계단을 내려가야 폭포를 가까이서 볼수 있어
몸이 불편하신 분들한테는 추천하지 않을래요~
그러나 폭포는 너무 멋졌고
사진을 찍기도 좋아요~",35,2484,2015/02,5,겨울
정방 폭포,시원한 물줄기,겨울에 갔는데도 시원한 물줄기와 미세하게 날아드는 물방울이 멋진 풍경을 만들어내고 있었다. 사진 찍기 좋은 곳이다.,35,2485,2015/01,4,겨울
정방 폭포,올레시장 근처로 접근하기 좋음,"비교적 싼 입장료로 올레시장구경하고 들릴만한곳
근처 산책코스도 있어보였지만 갈길이 멀어 폭포만 구경함
폭포만 보기에는 좀 아쉬운감이 있지만 입장료가 싸다는게 장점",35,2486,2015/10,3,가을
정방 폭포,폭포는 아주 멋진,폭포가 바다로 바로 떨어지는 모습은 어디에서도 보기 힘든 멋진풍경. 다만 관광객이 많으므로 비수기에 갈 것을 권유,35,2487,2015/11,3,가을
정방 폭포,정방폭포,"제주에서 자연물로는 가장 좋아하는 곳이예요.
매표소에서 걸어내려가기가 쉽진 않지만
내려가보면 떨어지는 폭포가 정말 놀라울정도로 멋져요.
유모차는 가기 어렵고요.
아기 동반하면 아기띠 필수일거 같아요",35,2488,2015/10,4,가을
정방 폭포,입구에서 정말 가까운 곳,"표 끊고 계단내려가니 바로 폭포가 보이네요.
다 보는데 진짜 5분도 안걸려요.
바다로 바로 떨어지는 폭포모습이 시원하고 멋있었습니다.
다만 바다이다보니 가까이 가려면 바위를 밟고 가야되서 운동화를 신고 오길 추천해요. 아님 위험할 꺼 같습니다.
입장료가 2천원인데 다른 볼거리가 없어 좀 아깝네요.",35,2489,2015/08,4,여름
정방 폭포,바다에 있는 독특한 폭포,바다에는 폭포가 거의 없다던데 특이한 폭포라 입소문이 많이 난 곳입니다. 가면 생각보다 웅장한 폭포에 놀랍고 좋다는. 여름에 가면 무척 시원할 거 같아요!,35,2490,2015/10,4,가을
정방 폭포,3대폭포,"많이들 가는 3대 폭포중 하나죠..
폭포는 뭐 다들 비슷하지만,,동선상 이동이 편해 가게되었어요
겨울이어도 사람이 많더라구요",35,2491,2014/12,5,겨울
정방 폭포,가족,한번쯤가볼만해요~폭포가 바다로 이어져요~달랑 볼거리가 하나인데..입장료가.. ㅜㅡㅡㅡㅡㅡㅡㅡㅡㅡㅡㅡㅡㅡㅡㅡㅡㅡㅡ,35,2492,2014/11,5,가을
정방 폭포,해안에 위치한 아름다운 폭포,"해안에 위치하고 있기 때문에 바다와 폭포를 한 곳에서 바라 볼 수 있다.
매우 아름다우며 가만히 앉아서 폭포를 관망하기 좋다.",35,2493,2014/12,4,겨울
정방 폭포,"많은 계단이 있더라도, 직접 내려가서 보는 것이 훨씬 좋아요.","정방폭포, 굳이 말하지 않아도 유명한 제주도의 관광지이죠. 가까운 곳에서 폭포를 보려면 많고 많은 계단을 내려가고, 구경을 마친 뒤에는 그 계단을 다시 올라와야 한다는 단점이 있었지만 그럼에도 불구하고 정방폭포는 반드시 직접 계단을 내려가서라도 보고 와야 한다는 생각이 들었습니다. 가까이서 보는 폭포는 정말이지 가슴을 탁 트이게 할 만큼 시원하고 아름다웠거든요. 몸이 조금 힘들어도 꼭 내려가서 보고 오시길 추천해드려요.",35,2494,2015/09,4,가을
정방 폭포,정방폭포 방문기,"해안에 위치한 폭포, 사람이 정말 많다. 해안은 몽돌이 많으므로 슬리퍼 신고 가는 것은 비추함.",35,2495,2015/09,4,가을
정방 폭포,서귀포에 간다면...,직접 보는 게 훨씬 더 멋있었네요. 계단 오르고 내리는 게 조금 힘들지만 그럴 만한 가치가 있구요...셀카 찍기도 멋진 풍경이네요..주차장 근처 한라봉 쥬스도 맛나요~,35,2496,2015/08,5,여름
정방 폭포,동양 유일의 해안폭포,"개인적으로 제주도에서 볼만한 폭포라고 생각해요.
천제연이나 천지연이 유명하지만.. 전 정방폭포가 더 괜찮은거 같아요.
일단 유량이 많았구요.
이 물들이 바로 바다로 들어가는게 신기했어요.
알고보니 동양 유일의 해안폭포라고 하네요.",35,2497,2015/01,5,겨울
정방 폭포,시원하고 멋진 폭포,"비오는날도 가보고 맑은 날도 가봤는데 어떤 날씨일때도 정말 좋은 폭포예요. 크고 바다와 이어져 있어서 정말 좋아요.
물이 막 안개처럼 뿌려져서 가까이 가면 정말 시원하답니다.",35,2498,2015/05,4,봄
정방 폭포,역시 제주의 명물,"제주는 매년 가지만 여행의 첫 기억을 살려 십수년만에 정방폭포에 갔습니다. 역시 멋지더군요.
하지만 오르내리는 계단이 너무 가파르고 좁아서 아이를 데리고 가기에는 좀 위험한듯합니다.",35,2499,2015/08,4,여름
정방 폭포,바다에서 보는 환상적인 폭포,"바닷가에 있는 정말 환상적인 폭포예요.
그동안 보았던 우리나라 폭포 중 가장 훌룡하네요.
제주도 가면 반드시 가봐야 하는 장소 중 하나인것 같아요.
폭포를 보는 건만 해도 시원해지는 기분
바다와 연결된 폭포여서 옆에 예쁜 바다도 보고 정말 좋네요.",35,2500,2014/10,5,가을
정방 폭포,제주도 폭포중에 가장 멋진 곳,"천지연폭포와 정방폭포를 가봤는데, 정방폭포가 10배쯤 멋있었어요. 절벽에서 바다로 바로 물이 떨어져내리고, 폭포 가까이에 들어갈 수 있어서 더 좋아요. 사진찍어도 다른 폭포보다 훨씬 멋있게 나와요.",35,2501,2015/06,5,여름
정방 폭포,바닷가에 접한 폭포,"바닷가에 접하여 있어 더욱 멋진 광경을 자아내는 폭포입니다. 주차장에 내려 계단을 내려기 전에 난간에서 정방폭포를 조망할 수 있으며, 계단을 내려가면 정방폭포 바로 아래로 접근할 수 있습니다. 폭포에서 물이 많이 튀어서 시원합니다.",35,2502,2015/07,4,여름
정방 폭포,시원한 자연의 체험,바다로 바로 떨어지는 시원한 폭포는 그 물줄기 높이며 폭이며 물안개와 함께 엄청난 흥분을 가져다줄것입니다. 실제로 눈 앞에 벌어지는 장관과 폭포의굉음은 다시 또 오리라는 약속을 하게 만듭니다.,35,2503,2015/08,5,여름
정방 폭포,개인적으로 천지연폭포보다 정방폭포가 갑!!,"천지연폭포, 정방폭포 둘다 가봤는데 정방폭포가 더 높고 주변경관이 좋아서 감동이었습니다. 폭포가 바로 바다로 이어지는 정방폭포!! 입장료내고 계단 내려가서 큰 바위",35,2504,2015/05,5,봄
정방 폭포,"바다로 바로 떨어지는 폭포, 의미를 생각하면 신기","한참 내려가면 볼 수 있는 정방폭포
심심하다고 할수도 있지만, 바다로 바로 떨어지는 폭포가 우리나라에 흔치 않다고 하니 나름 볼만함
체류시간은 아주 짧으니 잠깐 거처갈때 들러보는 정도가 좋음",35,2505,2015/07,4,여름
정방 폭포,해변가에 있는 멋진 폭포,해변가에 있는 멋진 폭포입니다. 조금 늦은 오후에 갔더니 일몰 방향에 폭포가 있어서 역광이었습니다. 멋진 사진을 담고 싶다면 늦은 오후는 피하시는 게 좋을 것 같네요.,35,2506,2015/07,4,여름
정방 폭포,단체사진 포인트,"폭포가 시원하고 볼만합니다.
가족사진이나 단체사진찍기에 딱 좋은 풍경이예요.
한번쯤은 꼭 가서 보시길..",35,2507,2015/06,4,여름
정방 폭포,속이 뻥 정방폭포,"햇볕 뜨거운 낮에 갔었는데 속이 뻥 뚫리는 기분이었네요~
폭포수 떨어지며 튀어오르는 물 맞으며 사진도 찍고~
한번 구경 할 만한 곳이에요. 다만 무릎 약하신 어르신 분들은 계단 오르내리기 조금 힘드실 수 도 있겠네요",35,2508,2015/06,4,여름
정방 폭포,흔한폭포느낌??,ㅋㅋㅋㅋㅋㅋ여기 꼭 가보라고는 하는데 사실.. 음...그냥 폭포예요..시원한 폭포.. 내려가는길 험하니까 조심하시구요!,35,2509,2015/07,4,여름
정방 폭포,비온후 방문. 짧은 시간에 보기 좋은 관광명소.,정방폭포 세번째 방문.이번이 제일좋았음.비 온뒤 물이 많아져서 현지인 추천으로 갔었는데 정말 멋졌음.동양에서 유일하게 바다로 떨어지는 폭포라 제주의 풍광과 잘 어우러짐..다른 관광 쿠폰이 적용되지 않으나 어른 2000원의 착한 가격..소요시간은 30분 ~1시간 정도 사진까지 충분히 찍을수 있고 주차시설도 좋음.,35,2510,2015/07,4,여름
정방 폭포,바다로 직접 떨어지는 세계유일의 폭포..,"가끔 정방폭포와 인근올레길을 걷곤한다.
세계에는 수없이 많은 폭포가 있지만 이곳 정방폭포는 이례적으로 폭포수가 직접 바다로 떨어지는 세계유일의 폭포이다. 가까이 가서보면 폭포수가 떨어지는 시원한느낌을 몸으로 귀로 눈으로 느낄수 있어 정말로 좋은곳이라 하겠다.",35,2511,2015/07,5,여름
정방 폭포,멋있어요,"입장료를 내고라도 가볼만한 폭포입니다.
아침 일찍 가면 입장료 없이 구경할 수 있어요.
제주도의 폭포중에는 가장 크고 멋지지 않나 싶어요.",35,2512,2014/12,5,겨울
정방 폭포,시원한 정방 폭포,깔끔하게 다듬어진 폭포로 다녀오는 길. 하지만 운동화 필수! 이젠 여행자의 수준도 올라가 휴지 하나 떨어져 있지 않다. 서로 머쓱해가며 사진 촬영을 요청하는데 남는 게 사진이니. 7월 말 한 여름 오전 10시쯤 다녀왔음에도 무척 시원한 폭포다.,35,2513,2014/07,5,여름
정방 폭포,사진보다 웅장했던 폭포,"절벽에서 떨어지는 폭포가 인상적!
근처에서 사진찍으면 폭포 미스트 한가득 맞을 수 있음.

입장료는 2,000원이며
8월이어서 그런지 사람이 엄청 많음.

자연의 신비로움을 느낄 수 있는 곳!",35,2514,2013/08,4,여름
정방 폭포,바다로 직접 떨어지는 폭포,저녁 무렵에 가서 잠깐 보고 왔지만 절벽에서 바다로 떨어지는 폭포수는 언제보더라도 신비하기 까지 합니다. 내려가는 길이 약간 가파르기 때문에 내려가는 길에 주의하여야 하며 야간에 개장하지 않으므로 5시 정도 까지는 꼭 방문을 해야 합니다.,35,2515,2013/12,4,겨울
정방 폭포,수량이 풍부한 폭포,"물이 흐르고 있는 강을 본 적이 없었는데, 계단을 내려가니 돌이 굴러다니는 해안 옆에 훌륭한 폭포가 있었어요.",35,2516,2013/04,3,봄
정방 폭포,절벽에서 바다로 떨어지는 폭포,서귀포에 있는 폭포 3개 중에 가장 좋아요. 해안절벽에서 바다로 떨어져요. 가까이 가면 작은 물방울들이 흩날리는데 8월이어서 시원했어요. 많은 관광객들이 잠깐동안 근처에 모여서 더위를 식히고 있었어요. 시간대도 좋았던건지 바다의 푸른색과 대비가 아주 멋져서 진짜 맘에 들었어요.,35,2517,2012/12,4,겨울
정방 폭포,상당히 좋았습니다.,"""당연히 별로 일거야."" 라고 생각하고 갔는데요,
꽤 웅장하고 훌륭한 폭포였습니다. 바다로 떨어지는 건 흔하지 않기도 하고요.
계단을 내려가 보았는데요, 거리는 알 수 있습니다.
주차장 앞의 관광 안내소 아주머니는 일본어도 잘 하고 친절했습니다.
택시도 불러주시고 많은 정보를 알려 주셨습니다.",35,2518,2011/10,3,가을
정방 폭포,제주도의 3대 폭포를 제패했습니다!,"제주도는 두 번째 갔습니다. 두 번째 만에 제주도의 3대 폭포를 제패했지만, 이 폭포가 가장 좋았던 것 같습니다. 서귀포에서 페리를 타 보려고 했지만 시간이 안 맞아서 직접 보러 갔습니다. 바다로 흘러 떨어지는 폭포는 음이온이 많이 포함되어 있어서, 많은 관광객이 구경하러 와 있었습니다. 계단은 돌아갈 때 오르는 것이 굉장히 힘들었지만, 열심히 내려가 볼 가치가 있습니다. 커다란 바위가 널려있기 때문에 넘어지지 않도록 조심하세요. 중문에 숙박하시는 분은 택시로!",35,2519,2011/09,5,가을
정방 폭포,음이온 100%입니다!,"일본에도 후쿠로다 폭포, 나치 폭포 등, 폭포를 매우 좋아하는 저입니다. 제주도에 갈 즈음하여, 이 명소에는 꼭 가고 싶어서 예정에 넣어 두었습니다. 택시 운전사는 다른 명소도 추천해 주었지만 이 폭포에도 가고 싶다고 말하자, 흔쾌히 데려다 주고 주차장에서 기다려 주었습니다.
폭포는 물론, 거기까지의 둘레길, 초목이나 꽃이나 시냇물이 무척 마음을 치유해 주었습니다.",35,2520,2011/09,4,가을
천지연 폭포,제주 방문시에는 꼭 들릴 만 한 곳입니다.,"주차장에서 산책하기에 딱 적당한 거리에 폭포가 있어서 좋았습니다.
제주도의 폭포중에서 단연 제일이라고 할 만 한 곳이었습니다.",36,2521,2017/01,5,겨울
천지연 폭포,잘 꾸며진 정원같은 곳,정말 정원처럼 잘 꾸며져있었습니다. 다양한 크기의 돌하르방도 여기서 다 볼 수 있었네요. 폭포는 그렇게 웅장하지 않은데 폭포로 가는 산책로가 아이들과 이용하기에 너무 좋습니다. 여기저기 사진찍을 곳이 많습니다. 여기를 이용하고 바로 옆에 있는 새연교를 걸으면 좋은 코스가 될 것 같습니다. 입장료는 2000원을 받고 있는데 안 아까웠습니다.,36,2522,2017/01,5,겨울
천지연 폭포,광고에서 보는 것과 또 다른 멋이 있습니다.,풍경도 좋고 바람 내음도 좋고 아주 좋습니다. 폭토도 시워시원하고 둘러보면서 자연을 만끽할 수 있습니다.,36,2523,2016/05,5,봄
천지연 폭포,꼭 가야되는곳,"제주도 하면 꼭 가봐야 하는곳이라고 생각함
시원 시원한 뷰도 좋고
제주도 하면 떠오르는 곳이라 꼭 방문해야한다고 생각되는곳",36,2524,2016/03,5,봄
천지연 폭포,추억의 공간,수학여행이나 제주여행에서 빼놓을 수 없는 곳이죠. 폭포로 향하는길도 아름답고 폭포도 시원하게 펼쳐져 좋았습니다.,36,2525,2016/03,4,봄
천지연 폭포,아담한폭포,매표소에서 15분쯤 산책삼아 걸어가면 천지연 폭포가 나와요. 웅장한 느낌은 아니고 적당히 아담한 폭포... 전 여기보다 정방폭포가 더 좋아요ㅋㅋㅋ,36,2526,2016/06,4,여름
천지연 폭포,밤이 더 좋았어요,낮에도 좋지만 저녁에 산책하러 가기 좋았어요. 조명들이 은은하게 켜져있어서 산책하면서 폭포구경하니 너무 좋았어요.,36,2527,2016/11,5,가을
천지연 폭포,이대로만 잘 보존되었으면,멋있고 깨끗한 이곳이 그대로 잘만 보존되기를 바랍니다. 유네스코가 인증한 곳이니 더 많은 관광객이 올테지만 장사좀 해보겠다고 주변에 지저분한 카페 프렌차이즈좀 그만 생겼으면 좋겠어요.,36,2528,2016/06,5,여름
천지연 폭포,천지연폭포,서귀포 칼 호텔에서 가까운 곳에 위치한 관광명소라 한번 찾아가봄. 어릴때 왔던 기억이 있었는데 지금 와서 보니 물이 적어서 그런가 거대한 폭포처럼 느껴지지는 않았다.,36,2529,2016/11,4,가을
천지연 폭포,아름다운 폭포,규모가 많이 크다고는 할 수 없지만 정말 아름답습니다. 천지연 폭포는 제주에 여행간다면 한 번쯤 가서 볼만 합니다. 날씨가 좋은 날에 간다면 더 아름다울 것입니다.,36,2530,2016/11,5,가을
천지연 폭포,한번은 볼만한경관,"입장료도 저렴하고 아이들과 산책하듯 들어가면 폭포를 만날수있다 비가오고 다음날 가면 물이 가장 많이 떨어지니 좋다
아이들이랑 가볍게 가기 좋은곳 간혹 야외홀에서 음악회를하기도해서 날짜만 잘맞춘다면 가성비갑인 명소",36,2531,2016/08,4,여름
천지연 폭포,편안한 걸음으로,보통 산속에 있는 폭포와 달리 평지를 걸어가면 만날 수 있다. 특히 비온뒤에 가면 물양이 많아서 더 근사하다. 어린아이도 충분히 걸어갈 수 있다. 가는 길은 폭포에서 흐른 시내를 따라 이어져 있는데 입구에서 파는 오리밥 한 봉지를 들고가면 큰 개만한 오리들이 마구 달려드는 모습을 볼 수 있다. 기회봐서 오리 엉덩이 깃털을 쓰다듬는 행운도!,36,2532,2016/10,5,가을
천지연 폭포,크게 볼 것은 없으나,"야간개장을 한다는 점에서 큰 점수를 주고 싶습니다.
다른 곳이 다 문을 닫아도 천지연폭포는 늦게까지 했거든요. 이곳이 없었더라면 저녁에 방 안에만 있어야 했을 거에요.",36,2533,2016/05,3,봄
천지연 폭포,천지연폭포 야간방문,비가 많이 안와서 물이많지않앗지만 조명으로 화려하게 비춰주고 콘서트등.. 볼것들이 많고 온다면 5시쯤 저녁먹고 늦은시간에 방문하길 추천한다,36,2534,2016/10,5,가을
천지연 폭포,시원하고 경치 좋고~,"밥 먹고 지나가다 유명해서 들렀어요~ 주차장 넓고 천지얀 폭포까지 가는 길이 너무 예뻐요~~ 물 위에 떠 다니는 오리들도 너무 귀여워요~ 가족단위 연인단위 모두 가기 괜찮은 곳이지만 볼 것은 오리와 폭포, 주위 예쁜 경치고 땀 많이 흘리지 않고 걸어가기 좋은 코스입니다~",36,2535,2016/08,5,여름
천지연 폭포,천지연폭포 야간 방문,미도호스텔에서 가까운 천지연 폭포 야간 방문을 했습니다. 2000원 입장료를 내고 들어갔을때는 분위기도 괜찮고 좋았습니다. 다만 폭포의 야간모습은... 생각외로 화려하지도 않고 별로였습니다 ㅠㅠㅠ,36,2536,2016/10,3,가을
천지연 폭포,야간 관람하기 좋은곳,서귀포 시내에서 저녁을 먹고 산책 겸해서 방문하기 좋은곳이었음. 야간관람을 허용하고 있어서 저녁식사후 숙소로 가기전에 들르기에 좋다고 생각됨. 조명시설들도 괜찮게 되어있음. 다만 밤이라 날벌레들이 조금 많다는것은 참고하시길..,36,2537,2016/09,5,가을
천지연 폭포,폭포보단 산책로,솔직히 폭포는 정말 아담하다. 수려한 멋이 있다는데 솔직하게 난 잘 모르겠다. 그래도 물가를 따라 천천리 걷다보면 마음이 편해지는 것은 사실이다.,36,2538,2015/10,3,가을
천지연 폭포,유명한 건 이유가 있죠,"아이들과 조용히 애기하며 가시면 됩니다. 물가에 오리도 있으니 과자도 쫌 준비하시고.

징검다리는 천천히 건네세요.",36,2539,2016/09,5,가을
천지연 폭포,서귀포에 들르셨다면 꼭 보세요,"입장 가격도 비싸지 않고 길이나 주변도 잘 정비 되어있어서 유료임에도 아깝지 않았습니다.
단순한 폭포라고 생각하실 수도 있으나 가는 길도 아름답고 폭포아래에 이루어진 연못에 오리들도 많아서 사진 찍기에도 좋은 장소입니다.",36,2540,2016/09,3,가을
천지연 폭포,밤에 가야 좋습니다.,"저녁에 조명이 있어서 늦은 시간에 가야 좋습니다.
너무 늦으면 9시 반인가 10시부터는 못 들어가니 조심하세요",36,2541,2016/07,5,여름
천지연 폭포,이국적인 풍경의 폭포,"천지연 폭포까지는 입구(매표소)부터
약 10분정도 걸어 들어가야함
폭포로 가는길도 나무 및 수풀이 우거져 아름다움

폭포에 도착하면 아름답고 이국적인 풍경을 마주할 수 있음",36,2542,2015/09,5,가을
천지연 폭포,불볕 열대야를 물리칠 천지연 폭포,천지연 폭포는 입구에 주차를 한 후 입장권을 끊고 약 500미터 정도 이동하면 보실 수 있습니다. 졸졸졸 흐르는 물길을 따라 올라가면 시원함이 그지 없는데요~ 천지연 폭포까지 올라가시면서 징검다리두 건너고 돌하르방과 사진도 찍고 오리들도 구경한다면 정말 즐거운 시간을 보낼 수 있을 겁니다. 물론 천지연 폭포를 보면 입이 쩍 벌어지면서 와~~~~할거에요!,36,2543,2016/07,5,여름
천지연 폭포,야간개장 좋네요~,"오늘 다녀왔어요~
여름엔 야간개장도 한다기에 밤 늦게 갔는데 덥지도 않고 서늘해서 돌아다니기 넘 좋았어요~
어딜 가도 입장료가 비싼 제주도였는데 상대적으로 저렴한 입장료(성인 1인당 2000원)도 맘에 들었구요.
폭포까지 거리가 길지 않아 어른들과 함께 가기에도 좋은 코스에요.",36,2544,2016/08,4,여름
천지연 폭포,폭포를 보러 걸어가는 경치도 좋습니다,폭포를 만나러 가는 길도 평탄하고 산책을 하는 느낌으로 갈 수 있어서 아주 좋습니다. 폭포보다는 주변경관이 아름다운 곳,36,2545,2016/05,5,봄
천지연 폭포,야간의 천지연폭포,야간에 천지연 폭포에 입장할 수 있어서 좋았습니다. 그러나 소리만으로 그 위용을 느끼기에는 역부족이었습니다. 다음엔 낮 시간에 가보고 싶습니다.,36,2546,2016/06,4,여름
천지연 폭포,제주도에 왔다면 여기는 방문 1순위 필수코스죠~,"비가 많이 온 이후라서 폭포수 소리가 더욱 우렁차게 들렸어요.
스트레스가 많아서 휴식을 위한 여행으로 왔는데 여기오면 스트레스 해소에 너무 좋아요.",36,2547,2016/07,5,여름
천지연 폭포,중문 관광단지안의 폭포,중문관광단지안에는 많은 관광지가 있지만 자연적인 관광지로는 단연 천지연 폭포를 빼놓을 수 가 없다. 매표소를 지나 산책을 하다보면 장엄한 폭포가 눈에 띄는데~꼭 방문하셔서 확인하세요~,36,2548,2015/08,5,여름
천지연 폭포,멋져요,제주 여행때 밤에 갈만한 명소중 단연1위인듯해요 야간에 보는 폭포도 아주 절경입니다 길도 험하지 않아서 유모차끌고 구경하기도 좋았어요,36,2549,2016/07,5,여름
천지연 폭포,비오는 날에도 좋은 곳,너무너무 유명한 천지연폭포! 맑은 날에 방문했었더라면 더 좋았겠지만 여행내내 비와 안개가 괴롭혔기에 비와도 폭포는 수량이 불어서 더 장관이지 않을까 하고 다녀왔습니다. 천지연 폭포는 비와도 나름의 축축한 매력을 가진 곳이었습니다.,36,2550,2016/07,5,여름
천지연 폭포,중문에 있는 천지연 폭포,"입장료가 있지만.. 굳이 돈을 내지 않아도
근처에서 볼 수 가 있는 폭포.
하지만 3개로 나뉘어 져 있는 폭포를 다 보려면~
그리고 가는 길에 숲으로 우겨진 나무냄세를 맡으려면
입장해서 보는 것도 추천한다.",36,2551,2016/07,5,여름
천지연 폭포,비는 왔지만 볼만했어요.,날씨가 좋지 않은 상태였지만 그럼에도 불구하고 멋졌습니다. 다만 출입구 표시가 좀더 명확했으면 좋겠어요.,36,2552,2016/07,4,여름
천지연 폭포,천지연폭포,"천지연폭포
하늘과 땅이 만나서 이룬 연못이라는 뜻이래요! 이름풀이가 너무 이쁘죠~
입장료도 조금있지만 저렴해서 가볼만해요~ 사람도 많으니까 이른시간에 들러주시면 여유있게 구경가능합니다.
너무 시원해서 한참을 서서 구경하고 사진찍다가 왔습니다.",36,2553,2016/01,5,겨울
천지연 폭포,아름답지만 규모가 크진 않습니다,아름답습니다만 그 규모가 크지 않습니다. 보러 안쪽으로 좀 걸어야하니 아주 더운날에는 참고하시고 가세요. 밤의 조경아래 폭포가 낮보다 더 아름답습니다,36,2554,2016/06,4,여름
천지연 폭포,천천히 즐기는 폭포,"천천히 즐기는 폭포,
그런데 관광객이 너무너무 너무 많아요
시간조절잘해서 들어가야 될 것같아요",36,2555,2016/06,4,여름
천지연 폭포,밤에도 볼수있는곳,여름에 특히더웠는데 시원한폭포를 감상할수 있어 너무나 좋았습니다. 제주도에서 관광객들로 제일 붐비는 곳중하나,36,2556,2015/08,4,여름
천지연 폭포,저는 별로였어요,"제가 갔을떄는 공사를 하고 있어서, 저는 구경하기에는 별로였었다라고 생각해요. 입장권이 아깝던데. 요즘은 어떨런지 모르겠네요.",36,2557,2015/08,3,여름
천지연 폭포,천지연폭포,"폭포를 향해 걸어가는 길이 평화롭고 시원합니다
가족과 함께 여행하기 좋은 관광지에요 시기별로 폭포수량 차이가 많아요",36,2558,2016/02,5,겨울
천지연 폭포,폭포 사진 찍기,입구에서 폭포까지 도보 10분 이내입니다. 폭포 앞에서 사진 찍기 좋습니다. 오전 일찍 방문해서 사람들이 많이 없어서 편안하게 사진 찍고 구경했습니다.,36,2559,2016/05,5,봄
천지연 폭포,비오는 날 보기에 좋은곳,"비오는날 보시면 폭포수 양이 많아 좋은것 같습니다.

약간 걸어 올라가야 하니 편한 신발을 신으세요~
입장료가 있으나 비싸지 않습니다.",36,2560,2016/05,4,봄
천지연 폭포,밤산책으로 추천합니다,"밤에 아이와 산책하기 참 좋은 코스였습니다
거리도 짧고 길이 평탄해서 아이와 걷기 부담 없었고 야경폭포도 새로운 경험이었습니다",36,2561,2016/05,5,봄
